{
  "organizationId": "e0000000-0000-4000-8000-000000000001",
  "sourceSystem": "slack",
  "sourceConnectionKey": "T-fixture",
  "knowledgeSpaceId": "e0000000-0000-4000-8000-000000000003",
  "actorUserId": "e0000000-0000-4000-8000-000000000004",
  "crawlCursor": "cursor-01-initial",
  "versions": {
    "content": "content/v1",
    "identity": "identity/v2",
    "membership": "membership/v1",
    "permission": "permissions/v1"
  },
  "identities": [
    {
      "kind": "SOURCE_USER",
      "nativePrincipalId": "U-an",
      "email": "an@slackfix.example",
      "displayName": "An",
      "ssoVerified": true,
      "idpIssuer": null,
      "idpSubject": null
    },
    {
      "kind": "SOURCE_USER",
      "nativePrincipalId": "U-bob",
      "email": "bob@slackfix.example",
      "displayName": "Bob",
      "ssoVerified": true,
      "idpIssuer": null,
      "idpSubject": null
    },
    {
      "kind": "SOURCE_GROUP",
      "nativePrincipalId": "C-general",
      "email": null,
      "displayName": "#general",
      "ssoVerified": false,
      "idpIssuer": null,
      "idpSubject": null
    }
  ],
  "memberships": [
    {
      "groupNativePrincipalId": "C-general",
      "captureStatus": "COMPLETE",
      "incompleteReason": null,
      "members": [
        {
          "kind": "SOURCE_USER",
          "nativePrincipalId": "U-an"
        }
      ]
    }
  ],
  "contents": [
    {
      "externalObjectId": "C-general-msg",
      "title": "General channel digest",
      "body": "The quarterly onboarding runbook lives in the general channel and covers laptop setup, VPN access, and the first-week checklist.",
      "contentRevision": "rev-1"
    }
  ],
  "permissions": [
    {
      "externalObjectId": "C-general-msg",
      "grants": [
        {
          "principalKind": "SOURCE_GROUP",
          "principalNativeId": "C-general",
          "gate": "ALLOW"
        }
      ]
    }
  ],
  "tombstones": []
}
